,restaurant_name,restaurant_logo,latitude,longitude,cuisine_tags,menu_items
0,Huff and puff,https://images.deliveryhero.io/image/talabat/restaurants/LOGO_636498747989252_636789246613382506.jpg?width=180,25.1744,55.2193,"American, Burgers","[['Meal For One', 'Your choice of burger with salted potatoes and soft drink.', 39.2, 'https://images.deliveryhero.io/image/talabat/Menuitems/1637905636869828259.PNG?width=172&amp;height=172'], ['Meal For Two', 'Any 2 burgers of your choice with 2 salted potatoes and 2 soft drinks of your choice.', 69.6, 'https://images.deliveryhero.io/image/talabat/Menuitems/2637905638625720054.png?width=172&amp;height=172'], ['Burgerian Pack 1', '1 omg slider, 1 fyi Slider,  melted cheese, and 2 soft drinks. Served with 2 salted fries.', 105, 'https://images.deliveryhero.io/image/talabat/Menuitems/blob_637685195683695432?width=172&amp;height=172'], ['Burgerian Pack 2', '1 fya slider, 1 asap slider, 1 onion rings, and  2 soft drinks. Served with 2 salted fries.', 105, 'https://images.deliveryhero.io/image/talabat/Menuitems/blob_637685195915957221?width=172&amp;height=172'], ['Chicken Burgerian Pack', '1 apache, 1 crispyify, 1 dynamiteable,  and 2 soft drinks. Served with 2 salted fries.', 119, 'https://images.deliveryhero.io/image/talabat/Menuitems/blob_637685195454615991?width=172&amp;height=172'], ['Shrimpoo Pasta', 'Pasta with Shrimps Coated in Shrimpoo Sauce, Mushroom  covered with Parmesan Cheese.', 36, 'https://images.deliveryhero.io/image/talabat/Menuitems/mmw_637842458317276929?width=172&amp;height=172'], ['  Onion Rings', '  Onion Rings', 12, 'https://images.deliveryhero.io/image/talabat/Menuitems/blob_637568157845737013?width=172&amp;height=172'], [' Honey Flame', ' Spicy dipped fried chicken with spicy Flame sauce and honey.', 28, 'https://images.deliveryhero.io/image/talabat/Menuitems/blob_637568157059739464?width=172&amp;height=172'], [' Dynamiteable', ' Fried chicken pieces served with Dynamiteable sauce and pasta.', 36, 'https://images.deliveryhero.io/image/talabat/Menuitems/blob_637568158252740375?width=172&amp;height=172'], ['Spicy Volcano Shrimp', '8 super jumbo shrimps coated in spicy volcano sauce with rich pasta', 42, 'https://images.deliveryhero.io/image/talabat/Menuitems/blob_637568157466319940?width=172&amp;height=172'], ['Storm Shrimp', '8 super jumbo shrimps coated in storm sauce with rich pasta', 42, 'https://images.deliveryhero.io/image/talabat/Menuitems/blob_637568157637074590?width=172&amp;height=172'], [' El Patron', ' Piece of spicy chicken, tomato, red cabbage, special mexican sauce, mexican tortilla.', 27, 'https://images.deliveryhero.io/image/talabat/Menuitems/EL_PATRON_637249667833341343.jpg?width=172&amp;height=172'], ['Kashta Box 2', '8 pieces of your choice served with cheese, lettuce, pickles, onion, jalapeno, bread, corn and free sauce.', 220, 'https://images.deliveryhero.io/image/talabat/Menuitems/Kashta_Box_1.jpg?width=172&amp;height=172'], ['Kashta Box 1', '10 shrimps skewers served with cheese, lettuce, pickles, onion, jalapeno, frankfort rolls, corn and free sauce.', 220, 'https://images.deliveryhero.io/image/talabat/Menuitems/Kashta_Box_2.jpg?width=172&amp;height=172'], ['Huffed & Stuffed Kashta Box', '8 pieces of stuffed beef with cheese, cheese slices, lettuce, pickles, onion, jalapeÃ±o, bread and corn', 250, 'https://images.deliveryhero.io/image/talabat/Menuitems/Huffed__Stuffed_Kashta_Box.jpg?width=172&amp;height=172'], ['The Queen', 'Crafted ðŸ’¯% Fresh Beef, American Cheese, Lettuce, Red Cabbage, Tomato & The Queen Sauce, Served in Butter Bun with fries on top of it.', 39, 'https://images.deliveryhero.io/image/talabat/Menuitems/mmw_637842458416491873?width=172&amp;height=172'], [' Chick-In Burger', ' Dipped fired chicken breast  , american cheese , lettuce , tomato , chick sauce , served in butter bun.', 29, 'https://images.deliveryhero.io/image/talabat/Menuitems/CHICK-IN_636498769608924758.jpg?width=172&amp;height=172'], [' Huff Burger', ' Fresh beef , american cheese , lettuce , huff sauce served in butter bun.', 29, 'https://images.deliveryhero.io/image/talabat/Menuitems/HUFF_BURGER_636498769566340846.jpg?width=172&amp;height=172'], [' Steak-Wich', ' Grilled steak, swiss cheese, grilled veg & mushroom sauce.', 30, 'https://images.deliveryhero.io/image/talabat/Menuitems/Steak-which_636565202380109603.jpg?width=172&amp;height=172'], [' Shrimping', ' Jumbo shrimps and mild spicy shrimping sauce, served in Frankfurt butter rolls', 34, 'https://images.deliveryhero.io/image/talabat/Menuitems/blob_637395727371637709?width=172&amp;height=172'], [' Puff Burger', ' Fresh spicy beef , american cheese , jalapeno , spicy puff sauce served in butter bun.', 34, 'https://images.deliveryhero.io/image/talabat/Menuitems/PUFF_BURGER_636498771571406509.jpg?width=172&amp;height=172'], ['  Crispyify Burger', '  Crispy fried fresh chicken with Crispyify sauce and lettuce. Served with butter bun bread.', 38, 'https://images.deliveryhero.io/image/talabat/Menuitems/blob_637662727130465848?width=172&amp;height=172'], ['  Apache Burger', ' Spicy fried chicken breast stuffed with cheese, American cheese and spicy apache sauce served in a butter bun', 39, 'https://images.deliveryhero.io/image/talabat/Menuitems/blob_637662000603472928?width=172&amp;height=172'], [' Puffed & Stuffed Burger', ' Fresh beef stuffed with mix cheese , jalapeno , lettuce , spicy stuffed sauce served in butter bun.', 40, 'https://images.deliveryhero.io/image/talabat/Menuitems/blob_637661998967779984?width=172&amp;height=172'], ['Huffed & Stuffed Burger', 'Fresh beef stuffed with mix cheese , lettuce , stuffed sauce served in butter bun.', 45, 'https://images.deliveryhero.io/image/talabat/Menuitems/blob_637661999674488457?width=172&amp;height=172'], ['  The CEO', '  Grilled ribs meat, mushroom sauce, caramelized onion, green capsicum and tomatoes. Served with gold leaves bun bread.', 58, 'https://images.deliveryhero.io/image/talabat/Menuitems/blob_637568154759735888?width=172&amp;height=172'], [' Omg', ' Spicy fried chicken, american cheese, lettuce, omg sauce served in butter bun.', 35, 'https://images.deliveryhero.io/image/talabat/Menuitems/OMG_636982556051214080.jpg?width=172&amp;height=172'], [' Fya', ' Grilled chicken, swiss cheese, lettuce, tomato garlic fya sauce served in butter bun.', 35, 'https://images.deliveryhero.io/image/talabat/Menuitems/FYA_636982556060704311.jpg?width=172&amp;height=172'], ['  Asap', '  Wagyu beef, american cheese, lettuce, asap sauce served in butter bun.', 35, 'https://images.deliveryhero.io/image/talabat/Menuitems/ASAP_636982556072725938.jpg?width=172&amp;height=172'], [' Fyi', ' Spicy wagyu beef, american cheese, lettuce, jalapeno, fyi sauce served in butter bun.', 35, 'https://images.deliveryhero.io/image/talabat/Menuitems/FYI_636982556083262941.jpg?width=172&amp;height=172'], ['  Potato Strips', '', 17, 'https://images.deliveryhero.io/image/talabat/Menuitems/blob_637582432303094920?width=172&amp;height=172'], [' Original Buffalo Wings', ' Original Wings with Buffalo Sauce', 34, 'https://images.deliveryhero.io/image/talabat/Menuitems/ORIGINAL_BUFFALO_WIN_636982556103332356.jpg?width=172&amp;height=172'], [' Boneless Buffalo Wings', ' Boneless Wings with Buffalo Sauce', 36, 'https://images.deliveryhero.io/image/talabat/Menuitems/blob_637406514810415244?width=172&amp;height=172'], ['  Classic Hot Dog', ' Classic Hot Dog in a bun served with Ketchup, Mayonnaise, & Mustard.', 20, 'https://images.deliveryhero.io/image/talabat/Menuitems/blob_637582444072152524?width=172&amp;height=172'], ['  H & P Way Hot Dog', ' Fried Hot Dog', 28, 'https://images.deliveryhero.io/image/talabat/Menuitems/blob_637582443932998177?width=172&amp;height=172'], ['H & P Nuggets', 'Five pieces nuggets, smiley fries, juice.', 22, 'https://images.deliveryhero.io/image/talabat/Menuitems/H__P_NUGGETS_636982556131987155.jpg?width=172&amp;height=172'], [' Huffy', ' Beef burger, american cheese, sauce served in butter bun, smiley fries, juice.', 28, 'https://images.deliveryhero.io/image/talabat/Menuitems/HUFFY_636982556142517331.jpg?width=172&amp;height=172'], [' Puffy', ' Chicken burger, american cheese, sauce served in butter bun, smiley fries, juice.', 28, 'https://images.deliveryhero.io/image/talabat/Menuitems/PUFFY_636982556153127593.jpg?width=172&amp;height=172'], ['Mint To Be Mojito', '', 24, 'https://images.deliveryhero.io/image/talabat/Menuitems/MINT_TO_BE_MOJITO_636498775568333857.jpg?width=172&amp;height=172'], [' Strawbtastic Mojito', '', 29, 'https://images.deliveryhero.io/image/talabat/Menuitems/STRAWBTASTIC_MOJITO_636498771633321728.jpg?width=172&amp;height=172'], [' Passion It Up Mojito', '', 35, 'https://images.deliveryhero.io/image/talabat/Menuitems/PASSION_IT_UP_MOJITO_636498771642092069.jpg?width=172&amp;height=172'], ['Bamba Mojito', 'This one-of-a-kind mojito have the best of both words, it combines the sweet flavor of mixed berries with the great power flavor of energy drink.', 29, 'https://images.deliveryhero.io/image/talabat/Menuitems/mmw_637886443421784382?width=172&amp;height=172'], ['Ce La Vie Mojito', 'This creative mojito with over-the-top refreshing taste of white grapes and energy drink will get you all the pleasure you look for in a mojito.', 28, 'https://images.deliveryhero.io/image/talabat/Menuitems/mmw_637886443725669824?width=172&amp;height=172'], ['Despacito Mojito', 'This refreshing mojito with mango, peach flavor and energy drink will give you all the fun you are looking for in a mojito.', 29, 'https://images.deliveryhero.io/image/talabat/Menuitems/mmw_637886443981883744?width=172&amp;height=172'], [' Coca -Cola', '', 8, 'https://images.deliveryhero.io/image/talabat/Menuitems/blob_637663586650726267?width=172&amp;height=172'], [' Coca -Cola Light', '', 8, 'https://images.deliveryhero.io/image/talabat/Menuitems/blob_637663586975703980?width=172&amp;height=172'], [' Sprite', '', 8, 'https://images.deliveryhero.io/image/talabat/Menuitems/blob_637663587243389245?width=172&amp;height=172'], [' Fanta Orange', '', 8, 'https://images.deliveryhero.io/image/talabat/Menuitems/blob_637663587630589135?width=172&amp;height=172'], [' H&P Water', '', 6, 'https://images.deliveryhero.io/image/talabat/Menuitems/blob_637720616139356919?width=172&amp;height=172'], [' Extra Sauce', '', 4, None], ['Extra Cheese', '', 4, None], ['Extra Melted Cheese', '', 5, None], [' Extra Jalapeno', '', 4, None], ['Extra Beef Bacon', '', 8, None], ['Extra Beef Patty', '', 10, None], ['Extra Egg', '', 4, None], [' Add Grilled Mushroom', '', 5, None]]"
1,Rock House Sliders,https://images.deliveryhero.io/image/talabat/restaurants/RHS_Logo_(500x500)_637718672687420207.jpg?width=180,25.101892,55.167842,"Burgers, Sliders, American","[['Side Chicks BOGO', '8 pieces hand breaded chicken nuggets, you wont forget this crunch, we betcha! (8 pcs)', 16, 'https://images.deliveryhero.io/image/talabat/Menuitems/9D788B001FDEC2C9F89F46995D77E764?width=172&amp;height=172'], ['Katsu Slider', 'Hand breaded crunchy chicken topped with asian cabbage & katsu sauce.', 25, 'https://images.deliveryhero.io/image/talabat/Menuitems/D7218E75CD17411AF565A62654A724B3?width=172&amp;height=172'], ['Avocado Chicken Slider', 'Hand breaded crunchy chicken topped with smashed avocado paste, lettuce & tomato.', 25, 'https://images.deliveryhero.io/image/talabat/Menuitems/0C66C7B87476D04FC332C5B8B99F1328?width=172&amp;height=172'], [""Kong's Double Smashed Slider"", 'Smashed double Angus beef slider, American cheddar cheese topped with KONGs sauce, lettuce & tomato.', 20, 'https://images.deliveryhero.io/image/talabat/Menuitems/358DD0598D69698E9EB3080DEE558430?width=172&amp;height=172'], ['10 Box', 'The 10 BOX (Choose any 5 sliders x 2) Perfect for your party, that big game night or just cause you can! (10 pcs)', 137, 'https://images.deliveryhero.io/image/talabat/Menuitems/BB334A755CF04429C79DB4C36AB8CD4F?width=172&amp;height=172'], ['Party Box', 'You next party, sorted 10 Sliders, 2 Side chicks, 2 fries (Choose any 5 Sliders x 2).', 249, 'https://images.deliveryhero.io/image/talabat/Menuitems/87948C98F46D66A04371F4FB3CDF4937?width=172&amp;height=172'], ['Football Box', 'Football Box: You next party, sorted 10 Sliders, 2 Side chicks, 2 fries. (Choose any 5 Sliders x 2).', 249, 'https://images.deliveryhero.io/image/talabat/Menuitems/D8D1EEE48227C4E55CE34C9E679DF3FE?width=172&amp;height=172'], ['Original Rocker', ""Angus beef slider, American cheddar cheese topped with 'OG' sauce, pickles, relish, shredded lettuce, shaved onions & tomato."", 16, 'https://images.deliveryhero.io/image/talabat/Menuitems/0F516F4616CE11868FC35F0B8E3C7647?width=172&amp;height=172'], ['Original Chicken', ""Hand breaded crunchy chicken, American cheddar cheese topped with 'OG' sauce, pickles & shredded lettuce."", 16, 'https://images.deliveryhero.io/image/talabat/Menuitems/E6EC9549DC220D30DDA7E2F57739AED6?width=172&amp;height=172'], ['Spicy Chicken', 'Hand breaded crispy spicy chicken, pepper jack cheese topped with spicy sauce, shredded lettuce, pickles & frizzled onions.', 17, 'https://images.deliveryhero.io/image/talabat/Menuitems/93168E6B1591807762CC5D08830EED40?width=172&amp;height=172'], ['Boston Truffle Mushroom', 'Angus beef slider, swiss cheese topped with truffle sauce, grilled mushrooms, grilled onions & relish.', 17, 'https://images.deliveryhero.io/image/talabat/Menuitems/15A185110717E34C5558A3B9FE0CFEB9?width=172&amp;height=172'], ['Kick My Boss - Spicy', 'Angus beef slider, American cheddar cheese topped with hot buffalo sauce, jalapeños, shredded lettuce, relish, shaved onions & tomato.', 18, 'https://images.deliveryhero.io/image/talabat/Menuitems/21F13ED6CFC24B0A73F192F383F18C0F?width=172&amp;height=172'], ['Smoke House BBQ Slider', 'Angus beef slider, American white cheddar cheese topped with beef bacon bits, homemade bbq sauce, cool ranch, pickles & frizzled onions.', 18, 'https://images.deliveryhero.io/image/talabat/Menuitems/97E2258D1505A821FF0854A491A00064?width=172&amp;height=172'], ['Messy Slider', ""Angus beef slider, natural cheddar cheese topped with RHS 'messy' sauce, chopped jalapeños, beef bacon bits & frizzled onions."", 18, 'https://images.deliveryhero.io/image/talabat/Menuitems/785CF271DAF6C9ACEC31C73A8C76E5C4?width=172&amp;height=172'], ['Original Rocker Plant Based', ""Impossible plant base patty slider, American cheddar cheese topped with 'OG' sauce, pickles, relish, shredded lettuce, shaved onions & tomato."", 25, 'https://images.deliveryhero.io/image/talabat/Menuitems/D2CEEF177E862C33E3FA2D2AC1E7C28D?width=172&amp;height=172'], ['Boston Truffle Mushroom Plant Based', 'Impossible plant base patty slider, swiss cheese topped with truffle sauce, grilled mushrooms, grilled onions & relish.', 25, 'https://images.deliveryhero.io/image/talabat/Menuitems/9D33DEC237EE24C9AB56827ED593B79A?width=172&amp;height=172'], ['Kick My Boss - Spicy Plant Based', 'Impossible plant base pattyslider, American cheddar cheese topped with hot buffalo sauce, jalapeños, shredded lettuce, relish, shaved onions & tomato.', 25, 'https://images.deliveryhero.io/image/talabat/Menuitems/33D25EABDC6C096DA6A6BFA55D26E9D1?width=172&amp;height=172'], ['Messy Slider Plant Based', ""Impossible plant base patty slider, natural cheddar cheese topped with RHS 'messy' sauce, chopped jalapeños, beef bacon bits & frizzled onions."", 25, 'https://images.deliveryhero.io/image/talabat/Menuitems/19D4A6A6532CD7ED190E45A76D26FD94?width=172&amp;height=172'], ['Original Fries', 'Crispy French fries made from 100% real potatoes.', 12, 'https://images.deliveryhero.io/image/talabat/Menuitems/7ABAEBC3D1EBABF900B71FD1B43539BD?width=172&amp;height=172'], ['Cheese Fries', 'Crispy French fries made from 100% real potatoes topped with Cheddar cheese.', 14, 'https://images.deliveryhero.io/image/talabat/Menuitems/EF85AB2069E75BFB5A39669E2D9B8E6D?width=172&amp;height=172'], ['Jalapeno Cheese Fries', 'Crispy French fries, Cheddar cheese sauce topped with chopped jalapeño & hot sauce.', 16, 'https://images.deliveryhero.io/image/talabat/Menuitems/7600A9E50355CA26158A1F8D2B897D4A?width=172&amp;height=172'], [""Rockin' Messy Fries"", ""Crispy French fries, Cheddar cheese topped with chopped jalapeños, beef bacon bits, frizzled onions & RHS 'messy' sauce."", 18, 'https://images.deliveryhero.io/image/talabat/Menuitems/199EB1A345D51957A552CF0EC54AC3C9?width=172&amp;height=172'], ['Side Chicks', '8 pieces hand breaded chicken nuggets, you wont forget this crunch, we betcha! (8 pcs)', 18, 'https://images.deliveryhero.io/image/talabat/Menuitems/C4D330C62DAC4DF48D4FAAFEA1CD3DB2?width=172&amp;height=172'], ['Buffalo Chicken Tenders', '3 pieces of crispy chicken tenders served with sticky buffalo sauce & cool ranch dip (3 pcs)', 21, 'https://images.deliveryhero.io/image/talabat/Menuitems/A6B0AC91E144ECB3A81D3BDD5BC55858?width=172&amp;height=172'], ['Messy Salad', ""Lettuce, natural cheddar cheese topped with RHS 'messy' dressing, jalapeños, frizzled onions & beef bacon bits."", 18, 'https://images.deliveryhero.io/image/talabat/Menuitems/1A4AF492A084D2753FADD75456A02579?width=172&amp;height=172'], ['Double Rocker Meal', 'CHOICE OF ANY 2 SLIDERS. Comes with crispy French fries made from 100% real potatoes + 1 soda (2 pcs)', 42, 'https://images.deliveryhero.io/image/talabat/Menuitems/2C9EF56C1E30A40AAC7FC8ADAE46688F?width=172&amp;height=172'], ['Triple Rocker Meal', 'CHOICE OF ANY 3 SLIDERS. Comes with crispy French fries made from 100% real potatoes + 1 soda (3 pcs)', 55, 'https://images.deliveryhero.io/image/talabat/Menuitems/A5FA95D4AFE206BFDAC86BF906290320?width=172&amp;height=172'], ['Mini Rocker Meal (mini meal)', 'Cheeseburger made with 100% all-natural angus beef patty. Served with crispy French fries made from 100% real potatoes + 1 natural juice (good for light nibbles) (1pc)', 27, 'https://images.deliveryhero.io/image/talabat/Menuitems/86121BE56C8BDC5EFE95088907B13809?width=172&amp;height=172'], ['Side Chicks Meal', '8 pieces of hand breaded chicken nuggets. Comes with crispy French fries made from 100% real potatoes + 1 soda (8 pcs)', 28, 'https://images.deliveryhero.io/image/talabat/Menuitems/AED5F232B64ADF21AC22494DABB5784E?width=172&amp;height=172'], ['Chicken Nuggets (mini meal)', '5 pieces hand breaded chicken nuggets served with crispy French fries made from 100% real potatoes + 1 natural juice (good for light nibbles) (5 pcs)', 27, 'https://images.deliveryhero.io/image/talabat/Menuitems/E07255E4F9C1E91F67198F8285CBBB72?width=172&amp;height=172'], ['Soft Drinks', '', 8, 'https://images.deliveryhero.io/image/talabat/Menuitems/1FB9928981A8862CBF6D8EB60D8FC91C?width=172&amp;height=172'], ['Fiji Water', '', 12, 'https://images.deliveryhero.io/image/talabat/Menuitems/94DD75964FD863A1FC9ACE41CC1ACEBE?width=172&amp;height=172']]"
